{"$schema":"https://json-schema.org/draft/2020-12/schema","$id":"novi.action-execution/1.0.0","title":"ActionExecution","type":"object","additionalProperties":false,"required":["execution_id","proposal_ref","authorization_ref","safety_ref","capability","started_at","execution_attempt","status","operation_id","runtime_version","provenance"],"properties":{"execution_id":{"type":"string"},"proposal_ref":{"type":"string"},"authorization_ref":{"type":"string"},"safety_ref":{"type":"string"},"capability":{"type":"string"},"started_at":{"type":"string","format":"date-time"},"execution_attempt":{"type":"integer","minimum":1},"status":{"type":"string"},"operation_id":{"type":"string"},"runtime_version":{"type":"string"},"hardware_target":{},"provenance":{}}}